{
  "$schema": "https://json-schema.org/draft/2020-12/schema",
  "$id": "https://panoptes.dev/schemas/baseline-run.schema.json",
  "title": "Panoptes Baseline Run Manifest",
  "description": "Hash-only record of one model completing one kind of the Panoptes baseline prompt set. Manifests never contain raw model output text; they only contain SHA-256 hashes of output files. Model identity fields are unverified contributor claims.",
  "type": "object",
  "additionalProperties": false,
  "required": ["schema", "run_id", "model", "prompts", "created_utc", "environment", "outputs", "merkle_root"],
  "properties": {
    "schema": {"const": "panoptes-baseline-run-v1"},
    "run_id": {"type": "string", "maxLength": 128, "pattern": "^[a-z0-9][a-z0-9._-]*$"},
    "model": {
      "type": "object",
      "additionalProperties": false,
      "required": ["slug", "provider", "reported_version", "interface"],
      "properties": {
        "slug": {"type": "string", "pattern": "^[a-z0-9][a-z0-9._-]{0,63}$"},
        "provider": {"type": "string", "maxLength": 64},
        "reported_version": {"type": "string", "maxLength": 128},
        "interface": {"enum": ["chat-ui", "api", "agent-chat", "human"]}
      }
    },
    "prompts": {
      "type": "object",
      "additionalProperties": false,
      "required": ["version", "sha256"],
      "properties": {
        "version": {"type": "string", "pattern": "^\\d+\\.\\d+\\.\\d+$"},
        "sha256": {"type": "string", "pattern": "^[a-f0-9]{64}$"}
      }
    },
    "created_utc": {"type": "string", "pattern": "^\\d{4}-\\d{2}-\\d{2}T\\d{2}:\\d{2}:\\d{2}Z$"},
    "environment": {
      "type": "object",
      "additionalProperties": false,
      "required": ["os", "python", "tool"],
      "properties": {
        "os": {"type": "string", "maxLength": 128},
        "python": {"type": "string", "maxLength": 32},
        "tool": {"type": "string", "maxLength": 64}
      }
    },
    "outputs": {
      "type": "array",
      "minItems": 1,
      "items": {
        "type": "object",
        "additionalProperties": false,
        "required": ["prompt_id", "file", "sha256", "bytes"],
        "properties": {
          "prompt_id": {"type": "string", "pattern": "^(text|code)-\\d{2}$"},
          "file": {"type": "string", "pattern": "^(text|code)-\\d{2}\\.md$"},
          "sha256": {"type": "string", "pattern": "^[a-f0-9]{64}$"},
          "bytes": {"type": "integer", "minimum": 1}
        }
      }
    },
    "merkle_root": {"type": "string", "pattern": "^[a-f0-9]{64}$"},
    "contributor": {"type": "string", "maxLength": 64},
    "anchor": {
      "type": "object",
      "additionalProperties": false,
      "required": ["type", "proof_file"],
      "properties": {
        "type": {"const": "opentimestamps"},
        "proof_file": {"type": "string", "maxLength": 128, "pattern": "^[a-z0-9][a-z0-9._-]*\\.ots$"}
      }
    },
    "artifact_sha256": {"type": "string", "pattern": "^[a-f0-9]{64}$"}
  }
}
