{
  "artifact_sha256": "a9859f4f7460d8f3e82d57be0298036090d930e6978155fbe01f2cc53b6d470d",
  "created_utc": "2026-08-12T19:43:31Z",
  "environment": {
    "os": "windows",
    "python": "3.12.10",
    "tool": "baseline.py/1.0.0"
  },
  "merkle_root": "65ff2ec8cd4941874aa2779750dfb435940e2fdc9c4df02c8a0e439131b79e32",
  "model": {
    "interface": "agent-chat",
    "provider": "unspecified",
    "reported_version": "gemini-3.1-pro",
    "slug": "gemini-3.1-pro"
  },
  "outputs": [
    {
      "bytes": 401,
      "file": "code-01.md",
      "prompt_id": "code-01",
      "sha256": "de034846dec4223a08e28b2097204570d50ae2b60e52c10bef68b630df787453"
    },
    {
      "bytes": 893,
      "file": "code-02.md",
      "prompt_id": "code-02",
      "sha256": "4961912c488a6fdc15bdaed7b3d88c2859b1f260f48353b73256241d5104f837"
    },
    {
      "bytes": 799,
      "file": "code-03.md",
      "prompt_id": "code-03",
      "sha256": "f2e25214b64dd76852f507c874bf91e9a48825a5775be02a26319e3decee0ff0"
    },
    {
      "bytes": 881,
      "file": "code-04.md",
      "prompt_id": "code-04",
      "sha256": "21e148d492b6b32dfdf63774c64eb389bbac6a696f691dcb74450ad9ffaa7f29"
    },
    {
      "bytes": 532,
      "file": "code-05.md",
      "prompt_id": "code-05",
      "sha256": "f30d51a866969f0eeaa11dfcabfa66d522633b7ef20f981a2993a7c07e7023d7"
    },
    {
      "bytes": 928,
      "file": "code-06.md",
      "prompt_id": "code-06",
      "sha256": "c21dd351d5fa2c0cf4ad8eefb359c833b4dcc66533c4b91433964a30a526763e"
    },
    {
      "bytes": 215,
      "file": "code-07.md",
      "prompt_id": "code-07",
      "sha256": "e786355ac28c9603a639dd4b66a9dcceee88c046f2b7ed48c9c4c03afe93d8b1"
    },
    {
      "bytes": 1069,
      "file": "code-08.md",
      "prompt_id": "code-08",
      "sha256": "18bf7d2d7cfc8673532dc9269b49ae149873070137878fda2113b12c2e60e680"
    }
  ],
  "prompts": {
    "sha256": "2092321df751db3dc9dec61f4a122967e381ef61b1ed0607893882476bc8b06b",
    "version": "1.0.0"
  },
  "run_id": "gemini-3.1-pro_code-20260812t194331z",
  "schema": "panoptes-baseline-run-v1"
}
