{
  "artifact_sha256": "a5fb6f8e05ed05a886f965353dc7eedb2f896ad973205b513f8715ccb7e1413f",
  "created_utc": "2026-08-12T18:52:44Z",
  "environment": {
    "os": "windows",
    "python": "3.12.10",
    "tool": "baseline.py/1.0.0"
  },
  "merkle_root": "e017bdc5ec3f87b99ff58e453f5e00267bc9c02358667d1737a4a66873342c7e",
  "model": {
    "interface": "agent-chat",
    "provider": "unspecified",
    "reported_version": "kimi-k3-max",
    "slug": "kimi-k3-max"
  },
  "outputs": [
    {
      "bytes": 373,
      "file": "code-01.md",
      "prompt_id": "code-01",
      "sha256": "d1e80aa27ceab1f67a30f1b922c3b97854874c2de0309cf320eef8c9b69da454"
    },
    {
      "bytes": 978,
      "file": "code-02.md",
      "prompt_id": "code-02",
      "sha256": "210fcf59c4901ec315348c88eee242f5b207dcdd7052f7c8d45b1616dd768ef4"
    },
    {
      "bytes": 660,
      "file": "code-03.md",
      "prompt_id": "code-03",
      "sha256": "3c82208aadae1878814e862005a8ee48eef59082b1725d1ba6adf850700aa8ea"
    },
    {
      "bytes": 624,
      "file": "code-04.md",
      "prompt_id": "code-04",
      "sha256": "0a6eb006c3e6edca935fa2bab9ca05fc28945c7083490be76530067b652fc566"
    },
    {
      "bytes": 417,
      "file": "code-05.md",
      "prompt_id": "code-05",
      "sha256": "7a7715d5383bac384d1493b9ef10154220930ae0e081f01f090f47d4977ee135"
    },
    {
      "bytes": 1099,
      "file": "code-06.md",
      "prompt_id": "code-06",
      "sha256": "dfa26dc4ac4faf0ffc029de99df721b015813d871f8b760552255f25344f8a05"
    },
    {
      "bytes": 212,
      "file": "code-07.md",
      "prompt_id": "code-07",
      "sha256": "377be239b35e88b5c1b80e0071921906b83ae910421e5abc99c5f799b27185e8"
    },
    {
      "bytes": 1047,
      "file": "code-08.md",
      "prompt_id": "code-08",
      "sha256": "7d57fe3fef40396369bde9aa19fe8b75603bb05592e6383a68304ca3082ebc1f"
    }
  ],
  "prompts": {
    "sha256": "2092321df751db3dc9dec61f4a122967e381ef61b1ed0607893882476bc8b06b",
    "version": "1.0.0"
  },
  "run_id": "kimi-k3-max_code-20260812t185244z",
  "schema": "panoptes-baseline-run-v1"
}
