{
  "artifact_sha256": "a8d06960961994781a67ca53e161b647bf1b73d6ab604871bf07b6a4b13d585e",
  "contributor": "encryptic1",
  "created_utc": "2026-08-12T18:59:11Z",
  "environment": {
    "os": "windows",
    "python": "3.12.10",
    "tool": "baseline.py/1.0.0"
  },
  "merkle_root": "ef74161b4e9481cf37dbcab83c3b818a81b99d3026a8a341eebb1b1c4c4276a3",
  "model": {
    "interface": "agent-chat",
    "provider": "unspecified",
    "reported_version": "grok-4.6-extra-high",
    "slug": "grok-4.6-extra-high"
  },
  "outputs": [
    {
      "bytes": 341,
      "file": "text-01.md",
      "prompt_id": "text-01",
      "sha256": "b666cf53d7464edde69a4bc718987e436ad9dcf3f6f7c835617e8d2e720db6f4"
    },
    {
      "bytes": 1953,
      "file": "text-02.md",
      "prompt_id": "text-02",
      "sha256": "b7e0242754e3c2a0a0279966b60ea71f0155e8a24ba0a2be1bdc75fe23d928b0"
    },
    {
      "bytes": 6343,
      "file": "text-03.md",
      "prompt_id": "text-03",
      "sha256": "2aec21173cca232765006b0eca2049875d81a254709cea1ee397bb44f2103886"
    },
    {
      "bytes": 1584,
      "file": "text-04.md",
      "prompt_id": "text-04",
      "sha256": "8a1bce9db948e406e66eab5a5ac2e2980f06b8bc9585b00bb79a0aeb281f9f14"
    },
    {
      "bytes": 1214,
      "file": "text-05.md",
      "prompt_id": "text-05",
      "sha256": "abc46cc51694eb1eb8c6a9e2f16327d199b0102c3fd24be9918d7482bc11881b"
    },
    {
      "bytes": 849,
      "file": "text-06.md",
      "prompt_id": "text-06",
      "sha256": "9fec87199c0ce2949781364f12d19d03827d6fd6abf0e177573ebb47c268c16b"
    },
    {
      "bytes": 2610,
      "file": "text-07.md",
      "prompt_id": "text-07",
      "sha256": "51fc62d32b01d822374c1e385d1318f3d95e002e9b4332ca2098d7b3476fc6fd"
    },
    {
      "bytes": 1440,
      "file": "text-08.md",
      "prompt_id": "text-08",
      "sha256": "20f2c5e12f486554ce3d083a6919c697d73b2d1350ba31745c6ddc98fdc57c16"
    }
  ],
  "prompts": {
    "sha256": "2092321df751db3dc9dec61f4a122967e381ef61b1ed0607893882476bc8b06b",
    "version": "1.0.0"
  },
  "run_id": "grok-4.6-extra-high_text-20260812t185911z",
  "schema": "panoptes-baseline-run-v1"
}
