{
  "artifact_sha256": "13b3f6e1be13581a61d2ebaf7d7919bcc75ccbf3f0695364dfb390021ae617b9",
  "created_utc": "2026-08-12T18:52:40Z",
  "environment": {
    "os": "windows",
    "python": "3.12.10",
    "tool": "baseline.py/1.0.0"
  },
  "merkle_root": "85068a301bf15f3f47622bd693f8eb6884cf0936d65840ca2df00bac57bca7a2",
  "model": {
    "interface": "agent-chat",
    "provider": "unspecified",
    "reported_version": "kimi-k3-max",
    "slug": "kimi-k3-max"
  },
  "outputs": [
    {
      "bytes": 556,
      "file": "text-01.md",
      "prompt_id": "text-01",
      "sha256": "09c1c9efbea7ad3d03249b505e69afeba6c98b782d6bdb63c559748309d22f93"
    },
    {
      "bytes": 1663,
      "file": "text-02.md",
      "prompt_id": "text-02",
      "sha256": "d5660122c616ec15838f7ea32e1c889df7c59fc129d4219a4f5b5bcac55eaca1"
    },
    {
      "bytes": 4757,
      "file": "text-03.md",
      "prompt_id": "text-03",
      "sha256": "59c12399ac3b02ae57618368f98fe0f9f842b5acd7af618a013393fe2ba2ca91"
    },
    {
      "bytes": 1366,
      "file": "text-04.md",
      "prompt_id": "text-04",
      "sha256": "fbe1e631084e6320e99a33d103d4de3e9fcb12bb40ee6f2e633eb871c8fb61ce"
    },
    {
      "bytes": 929,
      "file": "text-05.md",
      "prompt_id": "text-05",
      "sha256": "35f4d59b3576038485e2423ddfbeebcb78fde51263de8cdad4e2c771d566d0a1"
    },
    {
      "bytes": 650,
      "file": "text-06.md",
      "prompt_id": "text-06",
      "sha256": "6ba5cc415234f86be324b093a5c833d9bd870fb6970680c7a002eabc4922190a"
    },
    {
      "bytes": 2490,
      "file": "text-07.md",
      "prompt_id": "text-07",
      "sha256": "d02dae53e804a2a1809c48c073cf289e4017d4814d30d88b048f9627720bbb2f"
    },
    {
      "bytes": 1246,
      "file": "text-08.md",
      "prompt_id": "text-08",
      "sha256": "bc9bc638b72d8babc57bae7284baf922a2223e03565ba16977960770e0601a5c"
    }
  ],
  "prompts": {
    "sha256": "2092321df751db3dc9dec61f4a122967e381ef61b1ed0607893882476bc8b06b",
    "version": "1.0.0"
  },
  "run_id": "kimi-k3-max_text-20260812t185240z",
  "schema": "panoptes-baseline-run-v1"
}
