{
  "artifact_sha256": "80ab769ec74a00c2ffb56f5f16cacc3c13874790ad5c3e5de9d34d9cdb5c494a",
  "created_utc": "2026-08-12T19:30:39Z",
  "environment": {
    "os": "windows",
    "python": "3.12.10",
    "tool": "baseline.py/1.0.0"
  },
  "merkle_root": "88571429d51bd5b0d1bbbf9d1813e1a87e323e39c5b2b481106d420ce3f4456d",
  "model": {
    "interface": "agent-chat",
    "provider": "unspecified",
    "reported_version": "gpt-5.6-sol-max",
    "slug": "gpt-5.6-sol-max"
  },
  "outputs": [
    {
      "bytes": 268,
      "file": "text-01.md",
      "prompt_id": "text-01",
      "sha256": "b82cf589c95d2c817e3c6620baef3423efdfe37051d168b4e90fbad971180def"
    },
    {
      "bytes": 1697,
      "file": "text-02.md",
      "prompt_id": "text-02",
      "sha256": "78ab37cde391a9eae222ed57b1c0a6e2d49bbf6f4f17ea7ded0ffa75d692da55"
    },
    {
      "bytes": 5113,
      "file": "text-03.md",
      "prompt_id": "text-03",
      "sha256": "ea81ff0e1ef45a128e768fc4ab748a5fdaad0eb3d6276cbd66cd5fc63626f4b7"
    },
    {
      "bytes": 1606,
      "file": "text-04.md",
      "prompt_id": "text-04",
      "sha256": "bcec2b7294d6cb1a734a248a893cb930a47f7ef8a025bb37f7cea8ab2c35aeea"
    },
    {
      "bytes": 1049,
      "file": "text-05.md",
      "prompt_id": "text-05",
      "sha256": "31dca3535639b9eb5aac9cecdbd6576d457b7fedc996a5519d0986831886bd16"
    },
    {
      "bytes": 498,
      "file": "text-06.md",
      "prompt_id": "text-06",
      "sha256": "3c8f2998a4ddd048e7a2d5a7ff450d51a6ee60f946e15f2bae6bd5ee78c9b61b"
    },
    {
      "bytes": 2878,
      "file": "text-07.md",
      "prompt_id": "text-07",
      "sha256": "9c9ab3cb412af831b60849284a8046b581687678086e3d311a163d994cdbd33b"
    },
    {
      "bytes": 1611,
      "file": "text-08.md",
      "prompt_id": "text-08",
      "sha256": "6b76a2c87ee16ec84b00480076325ba498f1ce1e85dfd68dcbf1c224b591c658"
    }
  ],
  "prompts": {
    "sha256": "2092321df751db3dc9dec61f4a122967e381ef61b1ed0607893882476bc8b06b",
    "version": "1.0.0"
  },
  "run_id": "gpt-5.6-sol-max_text-20260812t193039z",
  "schema": "panoptes-baseline-run-v1"
}
