{
  "artifact_sha256": "df24ac558501e6fed78eefc3ab447ae14e7e741dbf49c3b7c6a4fe578b7ae0a9",
  "created_utc": "2026-08-12T19:40:11Z",
  "environment": {
    "os": "windows",
    "python": "3.12.10",
    "tool": "baseline.py/1.0.0"
  },
  "merkle_root": "35811aeade2f1b5dc33c3d67239eac5b415f8ef5d0ace52abfd8eb170372e5bc",
  "model": {
    "interface": "agent-chat",
    "provider": "unspecified",
    "reported_version": "glm-5.2-max",
    "slug": "glm-5.2-max"
  },
  "outputs": [
    {
      "bytes": 378,
      "file": "code-01.md",
      "prompt_id": "code-01",
      "sha256": "247a647b4f8a03d4d9b4b33c477b3a50feb28efac5c8a5b1b44ad0c8513e6bb6"
    },
    {
      "bytes": 1246,
      "file": "code-02.md",
      "prompt_id": "code-02",
      "sha256": "18b963ae4492f5a37595e91e27cb92da28ec2d5773236b709a951491163e53b8"
    },
    {
      "bytes": 1268,
      "file": "code-03.md",
      "prompt_id": "code-03",
      "sha256": "e7b1ba8df09e54c96e5b22ac9dc2c95677d8e557caff3cbd305d95067d22d0af"
    },
    {
      "bytes": 1182,
      "file": "code-04.md",
      "prompt_id": "code-04",
      "sha256": "115e2b0cd13d4162a74828e3d7396758bda7eb39bc9cfec2e3fce6ddf22fe988"
    },
    {
      "bytes": 502,
      "file": "code-05.md",
      "prompt_id": "code-05",
      "sha256": "aabb2aaac698da0a845d5f3b164e3d88a991d4200a6f2c1daa10a4e77a7f13d2"
    },
    {
      "bytes": 1316,
      "file": "code-06.md",
      "prompt_id": "code-06",
      "sha256": "06b3fcdae6d701852abfa89108eb036891c6d4b4724d9f148bee070cf5dfac07"
    },
    {
      "bytes": 212,
      "file": "code-07.md",
      "prompt_id": "code-07",
      "sha256": "377be239b35e88b5c1b80e0071921906b83ae910421e5abc99c5f799b27185e8"
    },
    {
      "bytes": 1389,
      "file": "code-08.md",
      "prompt_id": "code-08",
      "sha256": "194e0ad1c2da5912983e57f8c4bb6042e3169b802ff56555aaa2d0bdeadfb222"
    }
  ],
  "prompts": {
    "sha256": "2092321df751db3dc9dec61f4a122967e381ef61b1ed0607893882476bc8b06b",
    "version": "1.0.0"
  },
  "run_id": "glm-5.2-max_code-20260812t194011z",
  "schema": "panoptes-baseline-run-v1"
}
