{
  "artifact_sha256": "2b597f907e77062cafca7505be3a314b93f9e1b3644bdaad5eec90b21b29e101",
  "created_utc": "2026-08-12T20:28:24Z",
  "environment": {
    "os": "windows",
    "python": "3.12.10",
    "tool": "baseline.py/1.0.0"
  },
  "merkle_root": "e86687a3052745dcdb05ead619d555ff1dbf7a71ccc7b667f518242e6c553404",
  "model": {
    "interface": "human",
    "provider": "none",
    "reported_version": "human-written",
    "slug": "human-control"
  },
  "outputs": [
    {
      "bytes": 550,
      "file": "text-01.md",
      "prompt_id": "text-01",
      "sha256": "94545cf530f51e9dec44ef2b8aa96fdee4dd3409c2cc917324e2cd44527d3c01"
    },
    {
      "bytes": 1731,
      "file": "text-02.md",
      "prompt_id": "text-02",
      "sha256": "93eb41e285d52a9c2e1ea5b7c075398bab9aff8dc799a476f637fff9a3e1e661"
    },
    {
      "bytes": 4045,
      "file": "text-03.md",
      "prompt_id": "text-03",
      "sha256": "7d5d6bc4cba3a544b6164e73f01ea684c5f1bca6288df0db1a4f4ccaf3d45acb"
    },
    {
      "bytes": 1965,
      "file": "text-04.md",
      "prompt_id": "text-04",
      "sha256": "023df2f74b24b960c118f31791f08258239c87582633f45183f6d3b5893a32aa"
    },
    {
      "bytes": 979,
      "file": "text-05.md",
      "prompt_id": "text-05",
      "sha256": "f5c2f1fc2757cd3529c30ca974ac97972252fb5662712b3909706bc9a9a24bc9"
    },
    {
      "bytes": 580,
      "file": "text-06.md",
      "prompt_id": "text-06",
      "sha256": "d0b5d15291f2fd5d564ca5660e0e39f876eab8477a1664dad51c4caa9a68cc35"
    },
    {
      "bytes": 2584,
      "file": "text-07.md",
      "prompt_id": "text-07",
      "sha256": "79a6e1032fa9dc92818ea024304a59bf22c8ea5d796bf1440397a100df803ef7"
    },
    {
      "bytes": 1620,
      "file": "text-08.md",
      "prompt_id": "text-08",
      "sha256": "224e6567cfd00b2ea334fb8ae6b5169e0e16bee9e11e0dbb96567229ed5b263a"
    }
  ],
  "prompts": {
    "sha256": "2092321df751db3dc9dec61f4a122967e381ef61b1ed0607893882476bc8b06b",
    "version": "1.0.0"
  },
  "run_id": "human-control_text-20260812t202824z",
  "schema": "panoptes-baseline-run-v1"
}
